,title,overview,genre_ids,id
0,Shang-Chi and the Legend of the Ten Rings,Shang-Chi must confront the past he thought he left behind when he is drawn into the web of the mysterious Ten Rings organization.,"[28, 12, 14]",566525
1,Venom: Let There Be Carnage,"After finding a host body in investigative reporter Eddie Brock, the alien symbiote must face a new enemy, Carnage, the alter ego of serial killer Cletus Kasady.","[878, 28, 12]",580489
2,Clifford the Big Red Dog,"As Emily struggles to fit in at home and at school, she discovers a small red puppy who is destined to become her best friend. When Clifford magically undergoes one heck of a growth spurt, becomes a gigantic dog and attracts the attention of a genetics company, Emily and her Uncle Casey have to fight the forces of greed as they go on the run across New York City. Along the way, Clifford affects the lives of everyone around him and teaches Emily and her uncle the true meaning of acceptance and unconditional love.","[16, 35, 10751]",585245
3,Dune,"Paul Atreides, a brilliant and gifted young man born into a great destiny beyond his understanding, must travel to the most dangerous planet in the universe to ensure the future of his family and his people. As malevolent forces explode into conflict over the planet's exclusive supply of the most precious resource in existence-a commodity capable of unlocking humanity's greatest potential-only those who can conquer their fear will survive.","[878, 12]",438631
4,Free Guy,A bank teller called Guy realizes he is a background character in an open world video game called Free City that will soon go offline.,"[35, 28, 12, 878]",550988
5,Gunpowder Milkshake,"In her turbulent life as a professional assassin, Sam has no choice but to go rogue to save the life of an innocent 8-year-old girl in the middle of the gang war she has unleashed.","[28, 53, 80]",574060
6,Plan A,"Germany 1945, Max, a Jewish Holocaust survivor, meets a radical group of Jewish resistance fighters, who, like him, lost all hope for their future after they were robbed of their existence and their entire families were killed by the Nazis. They dream of retaliation on an epic scale for the Jewish people. An eye for an eye, a tooth for a tooth. Max starts identifying with the group's monstrous plans...",[53],714968
7,Jungle Cruise,"Dr. Lily Houghton enlists the aid of wisecracking skipper Frank Wolff to take her down the Amazon in his dilapidated boat. Together, they search for an ancient tree that holds the power to heal – a discovery that will change the future of medicine.","[12, 14, 35, 28]",451048
8,The Suicide Squad,"Supervillains Harley Quinn, Bloodsport, Peacemaker and a collection of nutty cons at Belle Reve prison join the super-secret, super-shady Task Force X as they are dropped off at the remote, enemy-infused island of Corto Maltese.","[28, 12, 14, 35]",436969
9,Encanto,"The tale of an extraordinary family, the Madrigals, who live hidden in the mountains of Colombia, in a magical house, in a vibrant town, in a wondrous, charmed place called an Encanto. The magic of the Encanto has blessed every child in the family with a unique gift from super strength to the power to heal—every child except one, Mirabel. But when she discovers that the magic surrounding the Encanto is in danger, Mirabel decides that she, the only ordinary Madrigal, might just be her exceptional family's last hope.","[12, 16, 35, 10751, 14, 10402]",568124
10,PAW Patrol: The Movie,Ryder and the pups are called to Adventure City to stop Mayor Humdinger from turning the bustling metropolis into a state of chaos.,"[16, 10751, 12, 35]",675445
11,Zone 414,"In the near future on a colony of state-of-the-art robots, a private investigator is hired by the colony's creator to bring his missing daughter home.","[878, 53, 9648]",675319
12,Space Jam: A New Legacy,"When LeBron and his young son Dom are trapped in a digital space by a rogue A.I., LeBron must get them home safe by leading Bugs, Lola Bunny and the whole gang of notoriously undisciplined Looney Tunes to victory over the A.I.'s digitized champions on the court. It's Tunes versus Goons in the highest-stakes challenge of his life.","[16, 10751, 35, 878]",379686
13,Separation,A young girl finds solace in her artist father and the ghost of her dead mother.,[27],760195
14,Ghostbusters: Afterlife,"When a single mom and her two kids arrive in a small town, they begin to discover their connection to the original Ghostbusters and the secret legacy their grandfather left behind.","[35, 14]",425909
15,Wrath of Man,"A cold and mysterious new security guard for a Los Angeles cash truck company surprises his co-workers when he unleashes precision skills during a heist. The crew is left wondering who he is and where he came from. Soon, the marksman's ultimate motive becomes clear as he takes dramatic and irrevocable steps to settle a score.","[28, 80, 53]",637649
16,The Croods: A New Age,"Searching for a safer habitat, the prehistoric Crood family discovers an idyllic, walled-in paradise that meets all of its needs. Unfortunately, they must also learn to live with the Bettermans -- a family that's a couple of steps above the Croods on the evolutionary ladder. As tensions between the new neighbors start to rise, a new threat soon propels both clans on an epic adventure that forces them to embrace their differences, draw strength from one another, and survive together.","[16, 10751, 12, 14, 35]",529203
17,Demonic,A young woman unleashes terrifying demons when supernatural forces at the root of a decades-old rift between mother and daughter are ruthlessly revealed.,"[27, 53]",774021
18,Rock Dog 2: Rock Around the Park,"When Bodi and his band 'True Blue' leave Snow Mountain, to tour with pop sensation, Lil' Foxy, they learn that fame comes at a price.","[16, 35, 10402, 10751]",812204
19,Old,A group of families on a tropical holiday discover that the secluded beach where they are staying is somehow causing them to age rapidly – reducing their entire lives into a single day.,"[53, 27]",631843
20,The Forever Purge,All the rules are broken as a sect of lawless marauders decides that the annual Purge does not stop at daybreak and instead should never end as they chase a group of immigrants who they want to punish because of their harsh historical past.,"[27, 28, 53]",602223
21,Malignant,"Madison is paralyzed by shocking visions of grisly murders, and her torment worsens as she discovers that these waking dreams are in fact terrifying realities with a mysterious tie to her past.","[27, 9648, 53]",619778
22,The Unholy,"Alice, a young hearing-impaired girl who, after a supposed visitation from the Virgin Mary, is inexplicably able to hear, speak and heal the sick. As word spreads and people from near and far flock to witness her miracles, a disgraced journalist hoping to revive his career visits the small New England town to investigate. When terrifying events begin to happen all around, he starts to question if these phenomena are the works of the Virgin Mary or something much more sinister.",[27],632357
23,Spirit Untamed,Lucky Prescott's life is changed forever when she moves from her home in the city to a small frontier town and befriends a wild mustang named Spirit.,"[16, 12, 10751, 37]",637693
24,Last Night in Soho,"A young girl, passionate about fashion design, is mysteriously able to enter the 1960s where she encounters her idol, a dazzling wannabe singer. But 1960s London is not what it seems, and time seems to be falling apart with shady consequences.","[27, 9648, 53]",576845
25,How the Grinch Stole Christmas,"Inside a snowflake exists the magical land of Whoville. In Whoville, live the Whos, an almost mutated sort of Munchkin-like people. All the Whos love Christmas, yet just outside of their beloved Whoville lives the Grinch. The Grinch is a nasty creature that hates Christmas, and plots to steal it away from the Whos, whom he equally abhors. Yet a small child, Cindy Lou Who, decides to try befriending the Grinch.","[10751, 35, 14]",8871
26,The Ice Road,"After a remote diamond mine collapses in far northern Canada, an ice road driver must lead an impossible rescue mission over a frozen ocean to save the trapped miners.","[28, 12, 18, 53]",646207
27,PAW Patrol: Jet to the Rescue,"Get ready to zoom back to Barkingburg with the pups in this all-new TV movie! When the scheming DUKE of Flappington steals a powerful levitation gem from the royal castle, it’s up to the PAW Patrol to jet to the rescue before the town is lost forever! Then join the PAW Patrol in even more high-flying adventures where they will save a stunt pilot, one of Mayor Humdinger’s kittens, and even Skye when she breaks her wing flying to Jake’s Mountain!","[10751, 16]",743439
28,Sing 2,"Buster and his new cast now have their sights set on debuting a new show at the Crystal Tower Theater in glamorous Redshore City. But with no connections, he and his singers must sneak into the Crystal Entertainment offices, run by the ruthless wolf mogul Jimmy Crystal, where the gang pitches the ridiculous idea of casting the lion rock legend Clay Calloway in their show. Buster must embark on a quest to find the now-isolated Clay and persuade him to return to the stage.","[10751, 35, 16, 18, 10402]",438695
29,Resident Evil: Welcome to Raccoon City,"Once the booming home of pharmaceutical giant Umbrella Corporation, Raccoon City is now a dying Midwestern town. The company’s exodus left the city a wasteland…with great evil brewing below the surface. When that evil is unleashed, the townspeople are forever…changed…and a small group of survivors must work together to uncover the truth behind Umbrella and make it through the night.","[27, 28, 878]",460458
30,King Richard,"The TRUE STORY of how Richard Williams served as a coach to his daughters Venus and Serena, who will soon become two of the most legendary tennis players in history.",[18],614917
31,The Green Knight,"An epic fantasy adventure based on the timeless Arthurian legend, The Green Knight tells the story of Sir Gawain, King Arthur's reckless and headstrong nephew, who embarks on a daring quest to confront the eponymous Green Knight, a gigantic emerald-skinned stranger and tester of men.","[12, 18, 14]",559907
32,Barbie & Chelsea: The Lost Birthday,"Enjoy high-sea thrills as Barbie, Chelsea and the rest of the Roberts family set sail on an adventure cruise.  ""Barbie & Chelsea The Lost Birthday"" tells the story of Chelsea, Barbie’s precocious youngest sister, and the rest of the Roberts family as they set sail on an adventure cruise for her seventh birthday. When they cross the International Date Line, Chelsea discovers her actual birthday has been lost and she embarks on a fantastical journey through an enchanted jungle island in order to save it.",[16],812456
33,The Last Duel,King Charles VI declares that Knight Jean de Carrouges settle his dispute with his squire by challenging him to a duel.,"[28, 18, 36]",617653
34,Azor,"Yvan De Wiel, a private banker from Geneva, is going to an Argentina in the midst of a dictatorship to replace his partner, the object of the most worrying rumours, who disappeared overnight. Between hushed lounges, swimming pools and gardens under surveillance, a remote duel between two bankers who, despite different methods, are the accomplices of a discreet and merciless form of colonization.",[18],659954
35,The Matrix,"Set in the 22nd century, The Matrix tells the story of a computer hacker who joins a group of underground insurgents fighting the vast and powerful computers who now rule the earth.","[28, 878]",603
36,Zeros and Ones,"Called to Rome to stop an imminent terrorist bombing, a soldier desperately seeks news of his imprisoned brother — a rebel with knowledge that could thwart the attack. Navigating the capital's darkened streets, he races to a series of ominous encounters to keep the Vatican from being blown to bits.","[53, 10752, 878]",762433
37,House of Gucci,"When Patrizia Reggiani, an outsider from humble beginnings, marries into the Gucci family, her unbridled ambition begins to unravel the family legacy and triggers a reckless spiral of betrayal, decadence, revenge, and ultimately…murder.","[18, 80, 53]",644495
38,No Man of God,The complicated relationship that formed between the FBI analyst Bill Hagmaier and serial killer Bundy during Bundy's final years on death row.,"[18, 36]",716594
39,The French Dispatch,"The quirky staff of an American magazine based in 1970s France puts out its last issue, with stories featuring an artist sentenced to life imprisonment, student riots, and a kidnapping resolved by a chef.","[18, 35, 10749]",542178
40,Titane,"A woman with a metal plate in her head from a childhood car accident embarks on a bizarre journey, bringing her into contact with a firefighter who's reunited with his missing son after 10 years.","[18, 53, 27]",630240
41,Stillwater,"Bill Baker, an American oil-rig roughneck from Oklahoma, travels to Marseille to visit his estranged daughter, Allison, who is in prison for a murder she claims she did not commit. Confronted with language barriers, cultural differences, and a complicated legal system, Bill builds a new life for himself in France as he makes it his personal mission to exonerate his daughter.","[18, 80, 53]",616651
42,Bad Boys for Life,"Marcus and Mike are forced to confront new threats, career changes, and midlife crises as they join the newly created elite team AMMO of the Miami police department to take down the ruthless Armando Armas, the vicious leader of a Miami drug cartel.","[53, 28, 80]",38700
43,Adventures of a Mathematician,"The warmhearted story of Polish immigrant and mathematician Stan Ulam, who moved to the U.S. in the 1930s. Stan deals with the difficult losses of family and friends all while helping to create the hydrogen bomb and the first computer.","[18, 36]",684281
44,Don't Look Up,"Two low-level astronomers, upon discovering that a meteor will strike the Earth in six months, go on a media tour to try to warn the world but find an unreceptive and unbelieving populace.","[35, 18, 878]",646380
45,Reminiscence,"Nicolas Bannister, a rugged and solitary veteran living in a near-future Miami flooded by rising seas, is an expert in a dangerous occupation: he offers clients the chance to relive any memory they desire. His life changes when he meets a mysterious young woman named Mae. What begins as a simple matter of lost and found becomes a passionate love affair. But when a different client's memories implicate Mae in a series of violent crimes, Bannister must delve through the dark world of the past to uncover the truth about the woman he fell for.",[878],579047
46,Cry Macho,"Mike Milo, a one-time rodeo star and washed-up horse breeder, takes a job from an ex-boss to bring the man's young son home from Mexico.","[37, 18]",749274
47,Benedetta,"In the late 17th century, with plague ravaging the land, Benedetta Carlini joins the convent in Pescia, Tuscany, as a novice. Capable from an early age of performing miracles, Benedetta’s impact on life in the community is immediate and momentous.","[18, 36, 10749]",454527
48,Spencer,"During her Christmas holidays with the royal family at the Sandringham estate in Norfolk, England, Diana decides to leave her marriage to Prince Charles.",[18],716612
49,Mainstream,A young woman finds a path to internet stardom when she starts making videos with a charismatic stranger.,"[35, 18]",557950
50,Penguin Bloom,"When an unlikely ally enters the Bloom family's world in the form of an injured baby magpie they name Penguin, the bird’s arrival makes a profound difference in the struggling family’s life.",[18],618416
51,The Power of the Dog,"A domineering, magnetic rancher responds with mocking cruelty when his brother brings home a new wife and her son, until the unexpected comes to pass.","[37, 10749, 18]",600583
52,Black Friday,A group of toy store employees must protect each other from a horde of parasite infected shoppers.,"[27, 35]",765869
53,Happiest Season,A young woman's plans to propose to her girlfriend while at her family's annual holiday party are upended when she discovers her partner hasn't yet come out to her conservative parents.,"[10749, 35]",520172
54,The Night House,"Reeling from the unexpected death of her husband, Beth is left alone in the lakeside home he built for her. Soon she begins to uncover her recently deceased husband's disturbing secrets.","[27, 53, 9648]",547565
55,C'mon C'mon,"A documentary filmmaker whose latest project involves gifted children bonds with his smart-yet-sensitive nephew, whose father struggles with bipolar disorder and is in the grips of a manic episode.",[18],632617
56,Sword Art Online the Movie -Progressive- Aria of a Starless Night,"One month after Kayaba Akihiko's game of death began, the death toll continues to rise, two thousand players having already lost their lives to the ultra-difficult VRMMO world of Sword Art Online. On the day of the strategy meeting to plan out the first-floor boss battle, Kirito, a solo player who vows to fight alone to get stronger, runs into a rare, high-level female player. She gracefully dispatches powerful monsters with a single rapier that flashes like a shooting star in the night...","[16, 28, 14, 878]",761898
57,Better Days,"A bullied teenage girl forms an unlikely friendship with a mysterious young man who protects her from her assailants, while she copes with the pressures of her final examinations.",[18],575813
58,Beasts Clawing at Straws,"The destinies of hard-luck lowlifes slowly converge and come crashing down: Jung-man barely gets by working at a sauna and taking care of his sick mother until he finds a bag full of cash in the locker room; Tae-young is in trouble after his girlfriend runs away with the money he borrowed from a loan shark. Soon, a dead body mysteriously turns up; Mi-ran, caught between her husband’s violence and a dead-end job as a bar hostess, she finds a young lover, Jin-tae who offers to kill her husband… And now their dog-eat-dog game starts.","[9648, 53, 80, 35, 18]",571648
59,Pig,A truffle hunter who lives alone in the Oregon wilderness must visit Portland to find the mysterious person who stole his beloved foraging pig.,"[18, 53]",635731
60,The Unforgivable,"Released from prison into a society that won't forgive her past, a woman seeks redemption by searching for the sister she left behind.",[18],645886
61,Copshop,"On the run from a lethal assassin, a wily con artist devises a scheme to hide out inside a small-town police station. However, when the hit man turns up at the precinct, an unsuspecting rookie cop finds herself caught in the crosshairs.","[28, 53, 80]",738652
62,The Real Charlie Chaplin,A look at the life and work of Charlie Chaplin in his own words featuring an in-depth interview he gave to Life magazine in 1966.,[99],788396
63,Respect,The rise of Aretha Franklin’s career from a child singing in her father’s church’s choir to her international superstardom.,"[10402, 18, 36]",592863
64,Legend Quest: The Legend of the Guanajuato Mummies,Leo San Juan returns to face the mummys,"[16, 27, 12, 35]",268690
65,Come True,"Looking for an escape from her recurring nightmares, 18-year-old Sarah submits to a university sleep study, but soon realizes she's become the conduit to a frightening new discovery.","[878, 27]",515454
66,Lamb,"An Icelandic couple live with their herd of sheep on a beautiful but remote farm. When they discover a mysterious newborn on their land, they decide to keep it and raise it as their own. This unexpected development and the prospects of a new family brings them much joy before ultimately destroying them.","[18, 27, 9648]",788929
67,Railway Heroes,Coming Soon,"[10752, 18, 28, 12]",889227
68,Luxor,"When British aid worker Hana returns to Luxor, a sleepy city on the banks of the Nile, she comes across Sultan, a talented archeologist and former lover. As she wanders, haunted by the familiar place, she struggles to reconcile the choices of the past with the uncertainty of the present.","[10749, 18]",653670
69,Belfast,"Buddy is a young boy on the cusp of adolescence, whose life is filled with familial love, childhood hijinks, and a blossoming romance. Yet, with his beloved hometown caught up in increasing turmoil, his family faces a momentous choice: hope the conflict will pass or leave everything they know behind for a new life.",[18],777270
70,The Card Counter,"William Tell just wants to play cards. His spartan existence on the casino trail is shattered when he is approached by Cirk, a vulnerable and angry young man seeking help to execute his plan for revenge on a military colonel. Tell sees a chance at redemption through his relationship with Cirk. But keeping Cirk on the straight-and-narrow proves impossible, dragging Tell back into the darkness of his past.","[18, 53, 80]",643532
71,Upon the Magic Roads,"Romantic John the Fool and his friend Foal set out on a series of unpredictable adventures in different magical worlds. The two buddies will have to outsmart an evil tyrant king, catch the firebird, and find John’s true love.","[12, 14]",576784
72,Dear Evan Hansen,"Evan Hansen, a high schooler with social anxiety, unintentionally gets caught up in a lie after the family of a classmate who committed suicide mistakes one of Hansen’s letters for their son’s suicide note.",[18],567690
73,Annette,"The story of Henry, a stand-up comedian with a fierce sense of humour and Ann, a singer of international renown. In the spotlight, they are the perfect couple, healthy, happy, and glamourous. The birth of their first child, Annette, a mysterious girl with an exceptional destiny, will change their lives.","[18, 10749, 10402]",424277
74,Licorice Pizza,"The story of Alana Kane and Gary Valentine growing up, running around and going through the treacherous navigation of first love in the San Fernando Valley, 1973.","[18, 35]",718032
75,Anaconda 3: Offspring,"Cancer-terminal tycoon Peter Murdoch's secret Wexel Hall Pharmaceuticals lab has developed a blood orchid extract cure. To examine why it works optimally in snakes, they also bread a super-anaconda strain. But the original pair escapes, leaving a bloody trail of corpses. Murdoch runs, instructing his staff to clean up. They keep failing and being eaten like unsuspecting locals, some alive, even after enlisting ruthless big game hunter Hammett. The fast-growing pregnant monster sheds its skin, thus disabling the only tracking device.","[28, 27, 53]",14863
76,Death Valley,"Mercenaries with nothing to lose are hired to rescue a bioengineer imprisoned in a cold war bunker. Upon entering the ominous facility, they find themselves in a fight for their lives when they come under attack from an unknown and deadly creature.","[28, 27]",892113
77,Bad Luck Banging or Loony Porn,"Emi, a school teacher, finds her career and reputation under threat after a personal sex tape is leaked on the Internet. Forced to meet the parents demanding her dismissal, Emi refuses to surrender to their pressure.","[35, 18]",790496
78,Till Death,"After a romantic evening at their secluded lake house, a woman wakes up handcuffed to her dead husband. Trapped and isolated in the dead of winter, she must fight off hired killers to escape her late spouse's twisted plan.","[27, 53]",672741
79,The Electrical Life of Louis Wain,"The extraordinary true story of eccentric British artist Louis Wain, whose playful, sometimes even psychedelic pictures helped to transform the public's perception of cats forever.","[18, 36]",617762
80,The Courier,"This intense action-thriller unfolds in real time as two embattled souls fight for their lives. Gary Oldman stars as a vicious crime boss out to kill Nick, the lone witness set to testify against him. He hires a mysterious female motorcycle courier to unknowingly deliver a poison-gas bomb to slay Nick, but after she rescues Nick from certain death, the duo must confront an army of ruthless hired killers in order to survive the night.","[80, 28, 18, 53]",611914
81,Trainspotting,"Heroin addict Mark Renton stumbles through bad ideas and sobriety attempts with his unreliable friends -- Sick Boy, Begbie, Spud and Tommy. He also has an underage girlfriend, Diane, along for the ride. After cleaning up and moving from Edinburgh to London, Mark finds he can't escape the life he left behind when Begbie shows up at his front door on the lam, and a scheming Sick Boy follows.","[18, 80]",627
82,Fatman,"A rowdy, unorthodox Santa Claus is fighting to save his declining business. Meanwhile, Billy, a neglected and precocious 12 year old, hires a hit man to kill Santa after receiving a lump of coal in his stocking.","[28, 35, 14]",602211
83,A Boy Called Christmas,"An ordinary young boy called Nikolas sets out on an extraordinary adventure into the snowy north in search of his father who is on a quest to discover the fabled village of the elves, Elfhelm. Taking with him a headstrong reindeer called Blitzen and a loyal pet mouse, Nikolas soon meets his destiny in this magical and endearing story that proves nothing is impossible…","[12, 10751, 14]",615666
84,Dead & Beautiful,"A group of young and spoiled rich kids turn into vampires after a night out, changing the course of their lives and driving a wedge between them all.",[27],660001
85,Pleasure,20-year-old Bella Cherry leaves her small town in Sweden for Los Angeles with the aim to become the world's next big porn star but the road to her goal turns out to be bumpier than she imagined.,[18],592695
