,title,overview,genre_ids,id
86,Tokyo Godfathers,"During a Christmas Eve in Tokyo, three homeless people, middle-aged alcoholic Gin, former drag queen Hana, and dependent runaway girl Miyuki, discover an abandoned newborn while looking through the garbage. With only a handful of clues to the baby's identity, the three misfits search the city to find its parents.","[16, 18]",13398
87,"Josee, the Tiger and the Fish","With dreams of diving abroad, Tsuneo gets a job assisting Josee, an artist whose imagination takes her far beyond her wheelchair. But when the tide turns against them, they push each other to places they never thought possible, and inspire a love fit for a storybook.","[16, 18, 10749]",652837
88,The Piano,"After a long voyage from Scotland, pianist Ada McGrath and her young daughter, Flora, are left with all their belongings, including a piano, on a New Zealand beach. Ada, who has been mute since childhood, has been sold into marriage to a local man named Alisdair Stewart. Making little attempt to warm up to Alisdair, Ada soon becomes intrigued by his Maori-friendly acquaintance, George Baines, leading to tense, life-altering conflicts.","[18, 10749]",713
89,The Bezonians,"In the Bezonians social club in North London, A group of down and outs scheme, plot and dream of becoming rich and breaking out of the monotony of their dreary and financially impotent lives.",[80],893508
90,Blue Bayou,"As a Korean-American man raised in the Louisiana bayou works hard to make a life for his family, he must confront the ghosts of his past as he discovers that he could be deported from the only country he has ever called home.",[18],644089
91,My Salinger Year,"A college grad takes a clerical job working for the literary agent of the renowned, reclusive writer J.D. Salinger.",[18],619594
92,Serial (Bad) Weddings 2,"Claude and Marie Verneuil face a new crisis. The four spouses of their daughters, David, Rachid, Chao and Charles decided to leave France for various reasons. Here they are imagining their lives elsewhere.",[35],505436
93,Nowhere to Run,Escaped convict Sam Gillen single-handedly takes on ruthless developers who are determined to evict a widow with two young children.,"[28, 18, 53, 10749]",10413
94,Nightmare Alley,An ambitious young carny with a talent for manipulating people with a few well-chosen words hooks up with a female psychiatrist who is even more dangerous than he is.,"[9648, 80, 18]",597208
95,Night Raiders,"The year is 2043. A military occupation controls disenfranchised cities in post-war North America. Children are property of the State. A desperate Cree woman joins an underground band of vigilantes to infiltrate a State children’s academy and get her daughter back. Night Raiders is a female-driven dystopian drama about resilience, courage and love.",[878],795778
96,Sunshine,"Fifty years into the future, the sun is dying, and Earth is threatened by arctic temperatures. A team of astronauts is sent to revive the Sun — but the mission fails. Seven years later, a new team is sent to finish the mission as mankind’s last hope.","[878, 53]",1272
97,Queenpins,"Bored and frustrated suburban homemaker Connie and her best pal JoJo, a vlogger with dreams, turn a hobby into a multi-million-dollar counterfeit coupon caper. After firing off a letter to the conglomerate behind a box of cereal gone stale, and receiving an apology along with dozens of freebies, the duo hatch an illegal coupon club scheme that scams millions from mega-corporations and delivers deals to legions of fellow coupon clippers. On the trail to total coupon dominance, a hapless Loss Prevention Officer from the local supermarket chain joins forces with a determined U.S. Postal Inspector in hot pursuit of these newly minted “Queenpins” of pink collar crime.","[35, 80]",628914
98,JFK Revisited: Through The Looking Glass,"Thirty years after his film JFK, filmmaker Oliver Stone takes viewers on a journey though recently declassified evidence in the assassination of President Kennedy - the most consequential American murder mystery of the twentieth century. Joined by Oscar-winning narrators Whoopi Goldberg and Donald Sutherland, as well as a distinguished team of forensics, medical and ballistics experts, historians, and witnesses, Stone presents compelling evidence that in the Kennedy case “conspiracy theory” is now “conspiracy fact.”",[99],836486
99,Lovers,"Set in Paris the story follows Lisa, who, while on vacation with her husband, rekindles a passionate affair with her ex-boyfriend. But that may lead to a murder.","[18, 53]",594691
100,Survive the Game,"When cop David is injured in a drug bust gone wrong, his partner Cal chases the two criminals who shot him. They all land at a remote farm owned by troubled vet Eric, and as Cal and Eric plot their defense, more of the gang arrives - along with a wounded David. Outnumbered, the three heroes must use stealth, smarts, and good shooting to take down the drug-dealing mob.","[28, 53, 80]",787310
101,Monster Family 2,"To free Baba Yaga and Renfield from the clutches of Monster Hunter Mila Starr, the Wishbone Family once more transforms into a Vampire, Frankenstein's Monster, a Mummy and a Werewolf. Aided and abetted by their three pet bats, our Monster Family zooms around the world again to save their friends, make new monstrous acquaintances and finally come to the realization that ‘Nobody’s Perfect’ – even those with flaws can find happiness.","[16, 10751]",823609
102,The Hand of God,"Fabietto Schisa, a boy in 1980s Naples whose teenage years are marked by unexpected joys like the arrival of football legend Diego Maradona, and an equally unexpected tragedy. Fate plays its part, joy and tragedy intertwine, and Fabietto’s future is set in motion in a tale of family, sports and cinema, love and loss.",[18],722778
103,Dream Horse,"The inspiring true story of Dream Alliance, an unlikely race horse bred by small town bartender, Jan Vokes. With very little money and no experience, Jan convinces her neighbors to chip in their meager earnings to help raise Dream and compete with the racing elites. Their investment pays off as Dream rises through the ranks and becomes a beacon of hope in their struggling community.","[35, 18]",603206
104,Parallel Mothers,"Two unmarried women who have become pregnant by accident and are about to give birth meet in a hospital room: Janis, middle-aged, unrepentant and happy; Ana, a teenager, remorseful and frightened.",[18],766798
105,Black Box,"Matthieu is a young and talented black box analyst on a mission to solve the reason behind the deadly crash of a brand new aircraft. Yet, when the case is closed by authorities, Matthieu cannot help but sense there is something wrong with the evidence. As he listens to the tracks again, he starts detecting some seriously disturbing details. Could the tape have been modified? Going against his boss' orders, Matthieu begins his own rogue investigation - an obsessional and dangerous quest for truth that will quickly threatan far more than his career...","[18, 53]",663260
106,Detective Conan: The Scarlet Bullet,"At the opening ceremony of the WSG (World Sports Games) Tokyo Games, a sports festival held once every four years, it is announced that the world's first vacuum superconducting maglev with a maximum speed of 1,000 kilometers per hour will open. While attracting attention from around the world, top executives of large companies are kidnapped from the party venue where WSG tournament sponsors gather. Conan moves toward a solution and eventually finds a connection with the WSG abduction case that occurred 15 years ago in Boston, USA.","[9648, 16, 28, 80, 10749, 53]",662638
107,Encounter,"Two young brothers go on the run with their father, a decorated Marine, who is trying to protect them from an unhuman threat. As the journey takes them in increasingly dangerous and unexpected directions, the boys will need to confront hard truths and leave their childhood behind.","[878, 53]",728526
108,Silent Night,"Nell, Simon, and their boy Art are ready to welcome friends and family for what promises to be a perfect Christmas gathering. Perfect except for one thing: everyone is going to die.","[35, 18, 27]",664574
109,The Translators,"Nine translators, hired to translate the eagerly awaited final book of a bestselling trilogy, are confined in a luxurious bunker.","[9648, 53]",477018
110,Memories of My Father,"Portrays the life of Héctor Abad Gómez, a prominent doctor and human rights activist in the polarized, violent Medellin of the 70s. A family man worried not only for his own children but those of the underprivileged classes as well, his home was imbued with vitality and creativity, the result of an education based on tolerance and love. Nothing could foretell that a terrible cancer would take the life of one of his beloved daughters. Driven by sadness and rage, Héctor devoted himself to the social and political causes of the time. But Medellin's intolerant society would harass him until he was finally silenced.",[18],660943
111,8-Bit Christmas,"In suburban Chicago during the late 1980s, ten-year-old Jake Doyle embarks on a herculean quest to get the latest and greatest video game system for Christmas.","[10751, 35]",802217
112,Wendy,"A re-imagining of ""Peter Pan"" from the point of view of Wendy Darling, who finds herself lost on a mysterious island where aging and time have come unglued. She must fight to save her family, her freedom and the joyous spirit of youth.","[14, 12, 10751]",399363
113,Being the Ricardos,Follows Lucille Ball and Desi Arnaz as they face a crisis that could end their careers and another that could end their marriage.,"[18, 36]",517088
114,The Worst Person in the World,"Chronicles four years in the life of Julie, a young woman who navigates the troubled waters of her love life and struggles to find her career path, leading her to take a realistic look at who she really is.","[35, 10749, 18]",660120
115,Christmas at the Ranch,"When Haley Hollis returns to her family ranch to try and save it from closure, she wasn't banking on spending so much time with ranch hand Kate - or falling for her.",[10749],805973
116,Cloudy Mountain,"The opening of the new tunnel, which took ten years to build, coincided with a series of serious cataclysms. The lives of 160,000 people depend on the actions of two people, a father and a son.","[28, 18, 53]",862855
117,Godard Mon Amour,"In 1967, during the making of “La Chinoise,” film director Jean-Luc Godard falls in love with 19-year-old actress Anne Wiazemsky and marries her.","[18, 10749, 35]",416186
118,Spoiled Brats,"The billionaire is tired of the whims of his own children and decides to teach them a lesson. He announces to them that he has become bankrupt. Now spoiled teenagers will have to do what they have never done: go to work, learn to love and value life.",[35],671043
119,The Big Bad Fox and Other Tales,"The misadventures of a young clumsy Fox and a feisty little red Hen.  The Fox, both a little stupid and naïve, tries daily to devour the little Hen, without success. Tired of the repeated humiliation, the Fox is persuaded to steal the Hen’s eggs to raise and then eat. This plan seems perfect, until the moment the chicks hatch…","[10751, 16, 35]",453191
120,Love Lesson,"Korea's most popular song writer Hee-soo (Kim Seon-yeong) runs into a nineteen-year-old boy in the elevator. Hee-soo is inspired by a new song watching him shake at her figure. She starts to tell him about women under the excuse that she's teaching him music. They fall for each other but things get complicated when her life teacher, Joon-ho who taught her about life and music comes back...","[10749, 18, 35]",286687
121,Off the Rails,"Now in their 50’s, three friends recreate an inter-rail journey across Europe, but this time 18-year-old Maddie is taking her mother’s place, fulfilling her dying wish. With lost passports, train strikes and romantic entanglements thrown in their way, they must put old feuds aside to complete the journey within five days and remind themselves that they are still at their peak.","[18, 35]",762904
122,France,"A celebrity journalist, juggling her busy career and personal life, has her life over-turned by a freak car accident.","[35, 18]",602334
123,Back to the Outback,"Tired of being locked in a reptile house where humans gawk at them like they are monsters, a ragtag group of Australia’s deadliest creatures plot an escape from their zoo to the Outback, a place where they’ll fit in without being judged.","[12, 16, 35, 10751, 10402]",770254
124,Sparkle,"Musical prodigy, Sparkle struggles to become a star while overcoming issues that are tearing her family apart. From an affluent Detroit area and daughter to a single mother, she tries to balance a new romance with music manager Stix while dealing with the unexpected challenges her new life will bring as she and her two sisters strive to become a dynamic singing group during the Motown-era.","[10402, 18]",88036
125,The Adventure of A.R.I.: My Robot Friend,A teenager summons the courage to help a friendly robot known as A.R.I. kidnapped by a ruthless lab director working for a powerful corporation seeking to turn him into a dangerous weapon in order to rule the world.,"[10751, 878]",682075
126,Coven,"French Basque Country, year 1609. The men of a small fishing village have gone to sea. Judge Rostegui, who has been charged by the king with ridding the country of the devil's wiles, arrests Ana and her friends and accuses them of witchcraft.","[18, 36]",655187
127,The Hating Game,"Resolving to achieve professional success without compromising her ethics, Lucy embarks on a ruthless game of one-upmanship against cold and efficient nemesis Joshua, a rivalry that is complicated by her growing attraction to him.","[35, 10749]",603661
128,Lansky,"When the aging Meyer Lansky is investigated one last time by the Feds who suspect he has stashed away millions of dollars over half a century, the retired gangster spins a dizzying tale, revealing the untold truth about his life as the notorious boss of Murder Inc. and the National Crime Syndicate.","[80, 18, 53]",693827
129,White Snake II: The Tribulation of the Green Snake,"While trying to free her sister from Fahai's clutches, Xiao Qing/Verta winds up in a dystopian city and meets a mysterious man who can't recall his past lives.  The sequel to Light Chaser's animated film about the legend of the White Snake.","[16, 14, 28, 12]",795607
130,Castle Falls,"Rival gangs seek out millions of dollars hidden inside a luxury condominium that's scheduled to be demolished, but first they have to deal with the janitor who found the loot first.","[28, 53]",683311
131,Christmas at Castle Hart,"Brooke Bennett goes to Ireland for Christmas to search for her Irish roots. While there, she meets Aiden Hart, Earl of Glaslough. Mistaken for an elite event planner, she’s hired to host his castle’s epic Christmas party.","[10770, 35, 10749]",874166
132,West Side Story,"Two youngsters from rival New York City gangs fall in love, but tensions between their respective friends build toward tragedy.","[18, 10749, 80]",511809
133,OSS 117: From Africa with Love,The third entry in secret agent OSS 117's parodic spy adventures.,"[12, 35, 28]",604563
134,Just 6.5,"The police are after a drug lord named Naser Khakzad, but when they finally manage to catch him, he tries whatever he can think of to escape and save his family.","[18, 28, 80, 53]",583794
135,National Champions,"A star quarterback ignites a players’ strike hours before the biggest game of the year in order to fight for fair compensation, equality, and respect for the athletes who put their bodies and health on the line for their schools.",[18],823425
136,The Survivalist,"A year and a half after the fall of civilization from a virus outbreak, a former FBI agent is forced to protect a young woman, who is immune to the disease, from a dangerous gang hunting her led by a psychopath who believes he’s going to use her to save the world.","[28, 53]",779057
137,Shark: The Beginning,"A bullied teenager who is locked up at a juvenile detention center due to an unexpected accident, meets a mixed martial arts champion to break through his own limits.",[28],801604
138,Son of the South,"Based on a true story, Bob Zellner, grandson of a Klansman, comes of age in the Deep South and eventually joins the Civil Rights Movement.","[36, 18]",686548
139,Nowhere Special,"John, a 35-year-old window cleaner, has dedicated his life to bringing up his 4-year-old son, Michael, after the child's mother left them soon after giving birth. When John is given only a few months left to live, he attempts to find a new, perfect family for Michael, determined to shield him from the terrible reality of the situation.",[18],728142
140,Deadlock,"Mack is a former soldier who, after the war, moved to a town with a nuclear power plant, where nearly everybody works. Life is peaceful for him there, until a gang of mercenaries led by Ron storm the reactor and take everybody hostage, including a group of children on a school trip. Now Mack is in a race against the clock and must use his military training to defeat Ron before he puts the reactor into meltdown. Along the way he discovers Ron’s motive, which unravels a greater secret Mack’s town is hiding.","[28, 53]",718949
141,A Journal for Jordan,"Chronicles Pulitzer Prize-winning journalist Dana Canedy's relationship with a soldier named Charles Monroe King. Deployed overseas in combat zones, he began writing a journal full of life lessons for their newborn son Jordan.","[18, 35]",501841
142,Agnes,"Rumors of demonic possession at a religious convent prompts a church investigation into the strange goings-on among its nuns. A disaffected priest and his neophyte are confronted with temptation, bloodshed and a crisis of faith.","[18, 27]",804755
143,The Devil's Light,"Sister Ann is a restless 25-year-old who devoutly believes that performing exorcisms is her calling. But she is at odds with the institution's traditions: nuns are not allowed to perform exorcisms, only priests. With the support of a mentor, a professor who senses her special gift, she is allowed to observe actual training sessions. Her desire to prove herself takes a personal turn when she meets one of the school's most disturbed patients. During their harrowing encounters, Sister Ann comes face to face with a demonic force that infests the school and has mysterious ties to her own past. It is then that the power of evil and her own startling abilities are fully realized.","[27, 53]",676547
144,Ted Bundy: American Boogeyman,"Set in a gritty and decadent 1970s America, American Boogeyman follows the elusive and charming killer and the manhunt that brought him to justice involving the detective and the FBI rookie who coined the phrase ‘serial killer’.","[53, 80]",835112
145,Being Black in Porn,Being Black in Porn follows the lives of four gay men of color as they navigate their way in the competitive and often complicated adult film industry.,[99],843857
146,The Djinn,A mute boy is trapped in his apartment with a sinister monster when he makes a wish to fulfill his heart’s greatest desire.,"[53, 27]",797946
147,The Last Son,"Set in the late 19th cen­tu­ry, mur­der­ous out­law Isaac LeMay learns from a sooth­say­er that he is cursed by a ter­ri­ble prophe­cy: he will be killed by one of his chil­dren. To pre­vent his own death, he tracks down his spawn, whose blood­lines are con­firmed by a hered­i­tary birth­mark. Despite hav­ing boun­ty hunters and the enig­mat­ic sher­iff Solomon on his tail, LeMay even­tu­al­ly finds his son Cal, who himself is on a mur­der­ing rampage…","[28, 18, 37, 12]",729577
148,The Pilot: A Battle for Survival,"December of 1941, Northwestern Front. A German tank column is moving towards Moscow. During a mission to stop the enemy advance, Nikolai Komlev's IL-2 is shot down. Komlev manages to crash-land his plane in a remote forest clearing. He's alive, but far from friendly territory. Ahead of him is a relentless trial of severe physical and mental endurance. After battling hunger and extreme cold, evading packs of wolves and detachments of Nazi soldiers, the wounded Komlev finally makes it back to safety. But there he faces another challenge, the most life-changing of them all.","[10752, 18, 36]",597859
149,Lapwing,"Mute young woman Patience, from an isolated community in rural England in 1555, struggles with her controlling brother-in-law and leader, David, who is gradually unraveling after the failure of his idyllic community. The Egyptian Act has been passed, stipulating that all ‘gypsies’ must vacate England immediately and anyone found aiding them could be executed. In exchange for a fee, David agrees to help an Egyptian family who must stay a month on their land until a ship comes to take them away. But when Patience pursues an affair with one of the outsiders, she is thrust into a violent and vicious psychological battle with David.","[18, 53]",874581
150,A Glitch in the Matrix,"Are we in fact living in a simulation? This is the question postulated, wrestled with, and ultimately argued for through archival footage, compelling interviews with real people shrouded in digital avatars, and a collection of cases from some of our most iconoclastic figures in contemporary culture.",[99],696109
151,Antoine and Colette,"Now aged 17, Antoine Doinel works in a factory which makes records. At a music concert, he meets a girl his own age, Colette, and falls in love with her. Later, Antoine goes to extraordinary lengths to please his new girlfriend and her parents, but Colette still only regards him as a casual friend. First segment of “Love at Twenty” (1962).","[35, 18, 10749]",256
152,Beauty,"The story of Beauty, an up-and-coming young singer with a glamorous career ahead of her, and Jasmine, a butch queer woman who falls for her best friend, Beauty.","[10749, 18]",667642
153,Aline,The life story of Canadian singing sensation Céline Dion.,"[18, 35, 10402]",498402
154,Marakkar - Arabikadalinte Simham,"‘Marakkar Lion of the Arabian Sea’ portrays the courageous life-events of a rebellious naval chief, Kunjali Marakkar the fourth, who fought against the Portuguese in the ancient times. He was the fourth naval chief of the Calicut Zamorin. The film revolves around him who was also the first Indian Naval Commander and Indian freedom fighter for the war against the Portuguese. He is said to have won 16 such battles with his impeccable strategies and fighting skills.","[36, 10752, 28]",617405
155,Wolf,"Jacob, a man who believes he is a wolf trapped in a human body, is sent to a clinic by his family where he is forced to undergo increasingly extreme forms of ""curative"" therapies at the hands of The Zookeeper. Jacob’s only solace is the enigmatic wildcat with whom he roams the hospital in the dead of night. The two form an improbable friendship that develops into infatuation.","[18, 9648, 53]",673121
156,The Ringer,"Pressured by a greedy uncle and a pile of debt, lovable loser Steve Barker resorts to an unthinkable, contemptible, just-crazy-enough-to-work scheme. He pretends to be mentally challenged to rig the upcoming Special Olympics and bring home the gold. But when Steve's fellow competitors get wise to the con, they inspire him to rise to the greatest challenge of all: becoming a better person.",[35],9927
157,Coda,A famous pianist at the twilight of his career meets a free-spirited music critic who soon becomes his rock as his mental state deteriorates.,"[10402, 18]",528761
158,Pirates,"On New Year's Eve 1999, three friends, who are attempting to break into the music scene through pirate radio, drive through London in a desperate search for tickets for the best millennium party ever.",[35],862360
159,Eureka: Eureka Seven Hi-Evolution,,"[16, 18, 12, 878]",843269
160,Hurt,Masks in horror conceal actors faces. Everyday masks conceal the disturbing undercurrent of those fighting inner demons.,[27],530156
161,Rebel Dykes,"A heady, energised mash-up of animation, unseen archive footage and interviews, Rebel Dykes provides an intimate insight into the politically charged, artistically radical subculture in 1980s London, and the individuals who helped shape and change their world. Bringing together BDSM nightclubs, inclusive, sex-positive feminism, DIY zine culture, post-punk musicians and artists, squatters, activists and sex workers, these rebel dykes went out onto the streets to make their voices heard.  [Feature length version of 2016 short of the same name.]","[99, 16, 36]",797874
162,The Birthday Cake,"On the 10th anniversary of his father's death, Giovanni reluctantly accepts the task of bringing a cake to the home of his uncle, a mob boss, for a celebration. Just two hours into the night, Gio's life is forever changed.","[80, 53]",624481
163,Haute Couture,"Esther is at the end of her career as Head Seamstress at Dior Avenue Montaigne workshop. One day, she gets her handbag stolen in the metro by a 20 years old girl, Jade. Instead of calling the police she decides to take care of Jade. She sees in her the opportunity to pass on her skills, the craft of dressmaking, her only wealth. In the frenetic world of Haute Couture, Esther will give Jade la beauté du geste, a way to reach beyond herself.",[18],719463
164,Where Is Anne Frank,"The film follows the journey of Kitty, the imaginary friend to whom Anne Frank dedicated her diary. A fiery teenager, Kitty wakes up in the near future in Anne Frank's house in Amsterdam and embarks on a journey to find Anne, who she believes is still alive, in today's Europe. While the young girl is shocked by the modern world, she also comes across Anne's legacy.","[16, 36, 18, 14, 10752]",426242
