,title,overview,genre_ids,id
333,Born to Be Human,"Yang Shi-Nan is a 14-year-old boy who undergoes a metamorphosis without realising what is going on. It begins on a normal school day when he gets stomach cramps. After rushing to the toilet he notices that his urine is turning bloody red. Taken to a doctor he is diagnosed with “Disorders of Sex Development,” or intersex. Without consulting him, Shi-Nan’s parents decide to accept “sex reassignment surgery”, turning Shi-Nan into a female and changing her name to YANG Shi-Lan. The family moves to a new city to start a new life and it all seems to be going well as Shi-Lan blends in and even makes friends. It seems like the butterfly is about to break out of its chrysalis but can Yang Shi-Lan truly embrace her transformation?",[18],799073
334,Akhanda,Akhanda is an upcoming Indian Telugu-language action drama film written and directed by Boyapati Srinu and produced by Miryala Ravinder Reddy under the banner of Dwaraka Creations.,"[28, 10749]",794961
335,Muddy,upcoming pan indian movie,[],885240
336,Worship,"Worship is premised on a hard reality of the poor in Thailand: the only way for them to climb the economic ladder is not with hard work and financial prudence, but by winning the game of chance—lottery. Many of them thus stay devoted to their faith out of fervent hopes that the deities would reciprocate their devotion by endowing them with luck and prosperity.",[],890370
337,C'est la vie,,[35],554375
338,Adam,"Abla runs a modest local bakery from her home in Casablanca where she lives alone with her 8-year-old daughter Warda. Their routine of housework and homework is interrupted one day by a knock on the door. It is Samia, a young woman looking for a job and a roof over her head. The little girl is immediately taken with the newcomer, but her mother initially refuses to allow a pregnant stranger into their home. Gradually, however, Abla's resolve softens and Samia's arrival begins to offer all of them the prospect of a new life.",[18],595875
339,Mollo tutto e apro un chiringuito,,[35],839287
340,Oh My Ghost 7,,[35],889616
341,The Last Matinee,"On a stormy night in Montevideo in 1993, an engineering student named Ana takes over the duties of her father, a projectionist at a declining movie theatre, due to his ill health. Unbeknownst to her, the audience watching the film that she is running are being murdered by a mysterious killer.","[18, 27]",739291
342,Whina,"Biopic about the life of Whina Cooper, an activist who worked tirelessly to improve the lives of fellow Māori women.",[18],766314
343,Lifelines,"Esther receives an anonymous diary, written 20 years ago by a young girl in hospital. The girl’s story resonates deeply with Esther, who is still suffering from a recent break-up. Supported by her best friend Elena, Esther becomes obsessed with finding the diary’s mysterious author and getting to know what became of her. Her investigation turns into a genuine introspective journey for Esther to heal, move on with her past and eventually come back to life.",[],783568
344,The School of the Magical Animals,"Ida is new to town and has a hard time making friends. One day her weird class teacher Miss Cornfield announces that everyone in the class will soon have a magical animal to accompany them. Ida is put to the side of the fox Rabbat. Benni, just like Ida also an outsider, has the turtle Henrietta as a new companion. The animals are something very special: They not only have magical abilities, they can also speak and develop their very own character! Henrietta is slow but wise. Rabbat, on the other hand, is very smart and shrewd. Due to his charismatic nature, Ida quickly becomes the star of the class, everyone is keen to be friends with her. One day there is great excitement in the Winterstein School: A thief is up to mischief and makes things disappear. The children and their magical animals go in search of the perpetrator.","[12, 10751]",793937
345,Pathos,"Once upon a time, the last days of 2028. This world’s disarray, no more no less than ever. Accommodate, adapt, evolve. The inability to live. The endless survival. Angela, a retired history teacher, has long lived in voluntary isolation, locked in an apartment in Lisbon. All her life, she refused conventions. Today, on Christmas Eve, she is faced with a “trivial” decision. Hospitality.",[18],702932
346,Jerk,"""Jerk"" is an imaginary reconstruction – strange, poetic, funny and somber – of the crimes perpetrated by American serial killer Dean Corll who, with the help of teenagers David Brooks and Wayne Henley, killed more than twenty boys in the state of Texas during mid-70s.",[],884255
347,Gurthunda Seethakalam,Romantic tale of a middle-aged software employee who has endured several heartbreaks in his quest to find true love.,"[10749, 18]",804916
348,En Formation,,[99],822761
349,Bon Bini Holland 3,,[35],800309
350,Dragon Girl,"Nine year old Sara befriends a newborn dragon, together they will turn Christmas upside down and literary put it on fire.","[10751, 14]",669337
351,3:33,,"[27, 53]",892121
352,Mission Extreme,"After bringing down the man behind the Dhaka Attack, Head of Bomb Disposal Unit, Abid Rahman learns that an invisible threat still hovering over Bangladesh.",[28],708510
353,"Здравствуй, Дедушка Мороз!","A Moscow journalist is sent to prepare a report on the work of Santa Claus on New Year's Eve. Dressed in the suit and beard of the main New Year's wizard, he gets home to the boy Sasha, to whom he promises to fulfill his desire - to return his dad.","[35, 10751]",891733
354,Чиновник,"Andrey, the owner of a construction company, has to turn to an official he knows for help in order to win a government tender and avoid bankruptcy. Everything is ready to meet the ""dear"" guest, but as soon as he crosses the threshold, everything goes awry from the very first minute.",[35],871879
355,One Half of Me,"Jaana is a restaurant owner and mother of two, who spends her free time riding. Jaana lives with her charismatic, but short-tempered partner Marko. Jaana's life changes in a flash when she becomes paralyzed in a serious accident.",[18],606787
356,Wuhan Driver,A Chinese Uber driver in New York struggles to make ends meet as he picks up passengers on a long and dreary night.,[18],812568
357,Some Women,"With bracing honesty, filmmaker Quen WONG shares her journey as a transgender woman in Singapore—from her days as a teenage boy coming out to her uncommonly supportive family, to the present as a woman about to marry the love of her life. Locating herself within the local trans community, the documentary also weaves in interviews with different generations of trans women including ‘Anita’, a former legend of Bugis Street—a world-famous stomping ground for trans women in the 1950s to the ’80s—and Lune LOH, a trans youth activist.",[],890369
358,Velle,"Rishi is a writer/director who is narrating a script close to his heart to Rohini - possibly the lead protagonist of his film. As he begins his narration, we step into the world of Rahul, Riya, Rambo and Raju - four friends living their best days amusing people with childish shenanigans in school.  These four ""Vellas"" are complete and content with each other's company and couldn't care less about the world around them until life hits them in the face. An enthralling script narration on one end, and four immature kids trying to correct a plan gone wrong on the other - Velle is about laughter, friendships, frenzy and the unpredictability of life.","[35, 80]",899439
359,Red Soil,"Freshly hired as a labor nurse in a chemical factory, Nour discovers that small arrangements exist between management and her father, Slimane, the staff representative, and the company's pivot. Lies about polluting discharges, hidden illnesses of employees, hidden accidents ... Nour, little by little, no longer accepts the compromises of his father to preserve the image of the company. She decides to launch the alert.",[18],712120
360,"V lete ti poviem, ako sa mám",,[35],835381
361,Lingui: The Sacred Bonds,"Thirty-year-old Amina, a practicing Muslim, lives alone with her only child, the fifteen-year-old Maria. When Amina learns Maria is not only pregnant but wishes to abort the child, the two women face an impossible situation in a country where abortion is legally and morally condemned.",[18],820693
362,Ladki,"""India’s First Martial Arts Film""",[28],651534
363,45 do Segundo Tempo,,[35],593890
364,Laila in Haifa,"The film was shot entirely in a nightclub, with an adjoining contemporary art gallery, whose customers are both Israelis and Palestinians, in one of Israel’s most open cities, Haifa. A long night in a place where the most diverse people meet: Jews, Muslims, gays, heterosexuals, transvestites; and three women, who in that multifaceted microcosm, a gathering peaceful hideout, can find shelter from male bullying and arrogance.","[36, 10749, 35]",728107
365,"My Tyrano: Together, Forever",A tremendous tyrannosaurus—who does not eat meat—and a pterodactyl who cannot fly run into each other and begin their journey to find ‘Paradise’.,"[16, 10749, 12, 14]",562464
366,Rose,"Rose, 78-year-old, has just lost her beloved husband. When her grief gives way to a powerful impulse to live her life, making her realize that she can still redefine herself as a woman, the whole balance of the family is upset.",[18],846864
367,Whether the Weather is Fine,"Against the backdrop of the typhoon Yolanda, a mother and her son struggle for survival and deal with absurdity of fate, sustained by the hope that they carry, and what is lost and gained.",[18],645575
368,Anti Indian,Baasha dies just few days before the assembly by-Election for Mylapore constituency while the election campaign by the political parties are in full swing. Various obstacles faced to bury the deceased are revealed.,[18],829493
369,To Kill the Birds & the Bees,"A pair of young twins, a secondary school prefect, and a conservative housewife each has a sex-related encounter during the course of a day.","[16, 35, 10402]",890431
370,Bheemante Vazhi,,"[35, 18]",860776
371,Les rêves ne meurent jamais,,[99],891455
372,Vladivostok,"Having accidentally committed a crime, Victor tries to evade responsibility and flees. He meets Nika and falls in love with her. The young people are trying to arrange Victor's illegal escape abroad, but events take an unexpected turn.",[18],862258
373,We All Are Santiago,,[99],888457
374,Gaalipata 2,"Life surprises you with its weird plans and events which changes our lives so much so that we can never go back to being what we were earlier. At such times we have to rise against the wind just like a kite does. It is the same with the story of Gaalipata 2. Its story is set in two different time zones, in two different places but with the same characters. It's about a turbulent yet fun filled journey of three friends and their love interests.",[35],691704
375,O duelo dos Santos,,[],890772
376,Nine Hills One Valley,"The desire for ethnic supremacy and emergence of politics of identity had put the people of Manipur to an unceasing violence, amplifying further mistrust and animosity amongst its population. Yet, in the face of distressed memories, hope thrives.",[99],899920
377,"Marapu, Fire & Ritual","Marapu, Fire & Ritual is a story that follows Pak Ledi, Poho Maga’s uncle, as he overcomes his family’s tarnished reputation by taking responsibility to fix the past. He believes it is the right timing to conduct a sacred four day ritual to invite the Marapu spirits back into the village. But not everyone agrees to this. Pak Ledi must first unite the village leaders.",[99],899919
378,Aruna Vasudev – Mother of Asian Cinema,"Aruna Vasudev, Founder of Netpac, Cinemaya & Cinefan Film festival has touched the lives of many in the world of Cinema. This documentary traces her roots from her humble origins in an undivided British India, to corridors of cinematic universe. It brings together her journey as a film critic, cinema activist and an impresario, weaving a tapestry that connects the dots that make the large canvas that we know as Asian Cinema Renaissance. This film explores her dynamism painted through a narrative unfolding lives of critics, filmmakers, curators and programmers – who are hidden maestros that largely make the cinephilia culture and by large remain unsung in histories of Cinema.",[99],899918
379,Three Strangers,"Gwa To, a transgender man from a remote village in Rakhine, plans for relationship impermanence, assuming all women will eventually move on to “real” men. Ma Soe, a high school dropout with a traveling troupe, has sworn off marriage because she doesn’t want to end up with a drunk like her father. At a village event, Gwa To sees Ma Soe sing and falls in love. After a brief period of courtship, Ma Soe and Gwa To live together as a couple. Their relationship is tested when Gwa To brings home a two-month old boy, Phoe Htoo, put up for adoption.",[18],899911
380,1997,Based on True Events happened in Andhra Pradesh.,"[80, 18]",899699
381,Rajavamsam,,"[28, 10751, 10749]",620769
382,Home,An ex-felon returns home from prison and must confront the demons of his past.,[18],669666
383,Jaalbandi,"On one hand, a renowned film producer, Adinath Mullick, comes to Anish's place to make a policy of INR 10 crores. Adinath wants Bharat Seva Ashram as the nominee of his policy. Then in the course of events, he wants to replace his nominee by someone called Chitralekha Sen. In the meantime, Adinath's son, Amitabha, and daughter, Gargi, both get greedy and start running after this money. They both want their names as the nominee and Anish falls into their trap. On the other, Gouranga's daughter Champakali sets a trap for Anish. She wants to marry Anish in exchange of convincing his father to make the deal done. In course of events, Anish meets Riyanka, a famous TV star, and coincidentally at that point of time, her husband Bobby takes his own life and Anish falls again into that trap again. Would he ever set free or fall into an unending nadir?","[18, 53]",897748
384,Tajemství staré bambitky 2,,"[10751, 14]",663302
385,Silvio Santos: O Sequestro,"Just 12 hours after having his daughter in the custody of a kidnapper, the influential communicator Sílvio Santos (Rodrigo Faro) faces an even more complicated obstacle: his home is invaded and he is held hostage for seven hours. Realizing that his life is at risk, he seeks refuge in the distant thoughts of his entire trajectory, which began when he was just a 14 year old teenager working as a street vendor.","[53, 80]",760147
386,To What Remains,"TO WHAT REMAINS is the story of Project Recover, a small team of accomplished scientists, oceanographers, archaeologists, historians, researchers and military veterans, who have dedicated their lives to scouring the depths of the ocean and the farthest corners of the earth, to search for, recover, and repatriate the remains of the more than 80,000 Americans missing in action since WWII.",[99],892506
387,The First Woman,"Eva’s being allowed to leave the psychiatric institution she’s lived in for six years. After a long year of waiting, the news arrive: an assisted living residence is found for her. Eva takes the first steps towards the ""normal"" life she longs for: to find a job, earn an income of her own, visit her mother... even find love. While she’s taking stock of her past and works on her self-confidence as well as her trust in the outside world, she also fixes firmly on her main goal: to reconnect with the son she lost custody of 20 years ago and ask him to forgive her. The First Woman is a film about second chances, the search for ""normality"" and the borderline between lucidity and darkness.",[99],792962
388,Alegría,,[18],809366
389,Any Day Now,"Bahman, Mahtab, Ramin and Donya Mehdipour are enjoying a perfect summer in a small Finnish town. Their routines are fractured by a negative decision on their application for asylum by the Finnish Immigration Service. But life must go on and the 13-year-old Ramin is about to enter an entirely new school, junior high. The Mehdipours use their last chance to appeal but continue their everyday lives, fuelled by their exceptionally positive outlook and attitude.",[18],666429
390,The Jesus Music,A political documentary that tells the stories of over 25 artists who give depictions of the controversy surrounding Christian Rock in the 70's.,"[99, 10402]",837693
391,I fratelli De Filippo,,[18],784374
392,Mind  Heist,"After being injured during a major heist, a jewel thief awakens at a safe house with no memory and must learn her identity, but she has to decide to believe the man claiming to be her husband or the hostage she's forbidden to speak to.",[53],872132
393,4 Kings,Relationships among vocational adolescents from 4 institutions,"[28, 18]",888683
394,It's a Flickering Life,"The story centers on a man who loves movies, who once worked at movie studio in pursuit of his dreams, surrounded by great directors and star actors. He and his friend fall in love with the daughter or cafeteria.",[18],751519
395,Fate/kaleid liner Prisma☆Illya: Licht Nameless Girl,,[],843243
396,Chandigarh Kare Aashiqui,"Manu, a bodybuilder from Chandigarh falls in love with Maanvi, a Zumba teacher. All seems well until a shocking revelation causes turmoil in their love story.",[10749],755836
397,frenesi.,,[10402],895725
398,Back to Mountain,,[99],896434
399,Self-Esteem,A man suffering from his sever inadequacies finds a way to solve all of his issues.,[35],895016
400,Valentina,,"[16, 10751, 10402]",800817
401,Old Man Jackson,"Mr. Jackson, an award winning automotive mechanics shop owner, and high strung hypochondriac, has a premonition. With no children of his own to pass the legacy that his grandfather started, he has one last mission to accomplish.",[35],858182
402,Narkali,"Narkali is a upcoming Tamil drama movie, directed by VZ Dhorai which had Ameer Sultan in lead role.",[18],735130
403,A Tale of Love and Desire,"Ahmed, 18, is French of Algerian origin. He grew up in the Parisian suburbs. On the benches of the university, he meets Farah, a young Tunisian full of energy recently arrived from Tunis. While discovering a body of sensual and erotic Arabic literature that he never knew existed, Ahmed falls deeply in love with this girl, and although literally overwhelmed by desire, he will try to resist it.","[18, 10749]",820702
404,Gujan saxena 2021,https://kofilink.com/1/bnYycDN4MDAwMDc4?dn=1,[],900143
405,Female Tazza,"Mimi started to gamble, dreaming of turning her life around. One night, she loses her family in front of her eyes in an unknown attack from an unidentified assailant.","[18, 80]",892856
406,A Brighter Tomorrow,"Thirty-something Mehdi is a safecracker. He and his mates are just trying to get by, but robbery isn’t paying like it used to. Day to day Mehdi tries to be a good son to his mother, and a good father to his 1-year-old son to win back his ex, Sarah.",[18],783555
407,The Perfect David,"David is not like your ordinary teenager. He obsessively works on his body—day and night—to reach the idealized self of a bodybuilder. His mother, a well-known artist, controls David’s every move and behavior, overseeing all aspects of her son’s regimen and his daily weightlifting training. As David dedicates himself to further developing his physique, his social life begins to call out to him. His clique of male friends, who relish making lewd and inappropriate jokes whenever they hang out, begins to beckon David to be more outgoing—while attractive classmate Mica sets her eyes on David and works to win him over.",[18],737012
408,Jail,,[18],614621
409,Theal,,"[28, 53]",591108
410,Randu,,[],893680
411,ARASHI Anniversary Tour 5×20 FILM “Record of Memories”,,[10402],842011
412,Bigger Than Us,,[99],842349
413,Connect 2021,"A compelling supernatural socio-political drama with sci-fi elements about Vincent, a young Black male who is struggling with his ability to communicate with the dead. In a moment of vulnerability, Vincent tells his roommate Monroe in confidence of his gift. Soon it is the talk of the community.  Director Bobby Huntley(written and directed by)  Stars Denise ArmstrongRonnie BakerSir Brodie",[878],853838
414,Velvet Crush,"An unsuspecting plumber with a velvet fetish answers a service call for a gorilla-loving nympho with the goods he's long treasured. Note: Script alone was submitted to five festivals in 2020, the film Velvet Crush was completed in 2021.",[35],892577
415,Louloute,"Louise revisits her childhood when her family decides to sell their farm. 20 years ago, she was Louloute, a mischievous and exuberant little girl, helping her father with their farm, fighting with her siblings and worrying her mother… When the family's debts accumulate and overwhelm them, tender childhood moments become intertwined with the harsh adult reality of a disappearing rural world.",[18],745980
416,GoodBi,"Goodbi is the disturbing tale of Beth, a young nursing student that finds herself driven to the brink of insanity by the increasing chaos that surrounds her. As she descends into an abyss of violence and paranoia, she is faced with the decision to die or become what she fears the most.",[27],886963
417,Let it Burn,"Arabella and her boyfriend David have just broken up. Not yet grounded in the decision, they take on the next question: how should they tell their classmates about it to avoid awkward situations at school? Instead, the discussion leads them into whether the breakup really is a mutual decision.",[18],859586
418,Hell's Half Acre,Wannabe YouTube Urban Explorers in an abandoned prison quickly realize they are not alone and have to find their way out as they fight for their lives against demonic inmates.,[27],874265
419,,October 1992. A group of law students head to a remote home upstate where a girl disappeared two years earlier.  Director,[18],853860
420,,,,
421,,,,
422,,,,
423,,,,
424,,0,2021-12-12,The Falling World
425,Istanbul,"Willy, a student, quits his vacation job to go to Istanbul with the sinister yet facinating Klamski. On the way from Ostend to Arlon some chance meetings unpuzzle the truth about Klamski, but Willy turns out to have a dark side as well.","[18, 53]",167938
426,A Bookshop in Paris,"Vincenzo dedicates his life to the bookshop he owns in Paris and to his daughter Albertine, forced to stay home because of an accident occurred to her a few years earlier. One day Yolande, an exuberant, eccentric, funny and beautiful girl, bursts into Vincenzo’s shop. Charmed by her vital energy, the man starts feeling again emotions he’s been chocking-off for too long, and which will make him question his melancholic and somehow suspended way of facing life.",[18],654344
427,The Last Execution,"The ambitious scientist Franz Walter doesn't hesitate when he is promised a professorship at the university. He immediately accepts, pledges absolute loyalty to the system and agrees to work for the GDR's foreign intelligence service until he can take up his new position. Together with his colleague Dirk, he is sent on foreign assignments to West Germany. Franz soon has to use blackmail to get innocent people to talk. But his superiors go even further: GDR refugees and their relatives are targeted to be psychologically destroyed, forged letters, medical diagnoses, surveillance and wiretapping are on the agenda. However, this is more than Franz can bear: he feels powerless and increasingly isolates himself. When he then decides to steal secret documents for a later defection to the West, this results in an unfortunate chain reaction leading to his arrest and ultimately to his execution...",[18],802121
428,"Lindsey Stirling LIVE, Home for the Holidays","Stirling wanted to go bigger for Christmas. She’s done a holiday tour for the past three years, and it didn’t feel right to break that tradition — especially during a year in need of cheer. An in-person tour was off the table, but she also wasn’t interested in doing a livestream performance — “there’s no way you can really capture a live show and make it feel live and vibrant on the screen,” she said.  Instead, the violinist decided to create somewhat of an extended, glorified music video with elaborate set pieces and costumes — elements that wouldn’t work in a live show because they’d take too long to remove or load on and off a truck each night. Doing this show on a budget, Stirling clocked 16-hour days for two months as creative director, designing the sets, sourcing the costumes and helping develop the choreography (including a performance where she hangs by her hair).","[10751, 10402]",775677
429,For Don Carlos,"Pour Don Carlos was the biggest production by Société des Films Musidora (est. December 10, 1919). Based on a novel by Pierre Benoît, Musidora’s first creatively autonomous work is set during the conflict between Carlists and Bourbons in late 19th century Spain. Benoît insisted that Jacques Lasseyne, a Spanish grandee who put money into the production, should co-direct. The film was shot in 1920, in the Spanish Basque Country. It represents a turning point in Musidora’s career, sparking her passionate love affair with a country and a culture that welcomed her as a great star. Above all, though, she encountered Antonio Cañero, a bullfighter who acted as her technical adviser on the film. Because of him, she did all she could to ensure that her succeeding productions, until 1926, were shot in Spain. Pour Don Carlos was released in Paris and in Madrid in December 1921, in a shortened version because its original, three-hour length made it impossible to release in the market of the time.",[18],607291
